{
  "version": 1,
  "name": "Aurora Gradient",
  "render": {
    "layer": "front",
    "surfaceOpacity": 0.72,
    "backgroundColor": "#05080d",
    "pauseWhenUnfocused": true,
    "opaqueEditorForMedia": true
  },
  "performance": {
    "profile": "balanced",
    "suspendAfterSeconds": 15
  },
  "layers": [
    {
      "id": "aurora",
      "type": "gradient",
      "colors": [
        "#061326",
        "#0f4660",
        "#51216d",
        "#102a55",
        "#061326"
      ],
      "angle": 135,
      "animationDuration": 18,
      "opacity": 1,
      "blendMode": "normal",
      "position": "center",
      "scale": 1.08,
      "rotate": 0,
      "parallax": 8,
      "filters": {
        "blur": 0,
        "brightness": 0.85,
        "contrast": 1.1,
        "saturation": 1.25,
        "hueRotate": 0,
        "grayscale": 0
      }
    }
  ],
  "effects": {
    "overlayColor": "#02060c",
    "overlayOpacity": 0.08,
    "vignette": 0.35,
    "grain": 0.04,
    "scanlines": 0
  }
}
